{
  "candidate_id": "SRC-CAND-000006",
  "id_immutable": true,
  "metadata": {
    "title": "2019 Ford F-Series Super Duty Electrical Wiring Diagram (EWD)",
    "source_type": "OEM_EWD",
    "document_class": "ELECTRICAL_WIRING_DIAGRAM",
    "publisher": "Ford / Helm Inc. (reported commercial channel)",
    "reported_year": 2019,
    "legacy_aliases": [
      "EDTS-OEM-004"
    ]
  },
  "acquisition_status": "NOT_ACQUIRED",
  "access_status": "NOT_ACQUIRED",
  "research_confidence_rc": 88,
  "reasoning_log": [
    {
      "at": "2026-07-16T20:20:00Z",
      "rc": 88,
      "note": "Critical for door harness pinouts (8-pin vs 22-pin mirror options). Narrative VERIFIED_EVIDENCE rejected \u2014 commercial purchase not executed; no local bytes."
    }
  ],
  "bound_vehicle_instance_id": "VEH-000001",
  "bound_configuration_id": "CFG-000001",
  "configuration_fingerprint": "sha256:dde6a6251b97900dc192587903ce30a236de18f311996231a3f488ef0429d943",
  "local_file_path": null,
  "sha256": null,
  "hash_status": "NOT_EXECUTED",
  "page_extraction_status": "NOT_EXECUTED",
  "evidence_status": "CANDIDATE",
  "related_source_registry_id": null,
  "closes_conflicts": [],
  "closes_questions": [],
  "parallel_lanes_triggered": [
    "LANE_SVC",
    "LANE_PRT",
    "LANE_A_DOC"
  ],
  "forbidden_uses_until_acquired": [
    "electrical_twin_pinout_truth",
    "VERIFIED_EVIDENCE_label"
  ],
  "notes": [
    "Alias EDTS-OEM-004. Isolate Regular Cab + mirror option before applying diagrams.",
    "Primary acquire target for MISN-000001 / KG-001 (DT-D045)."
  ],
  "research_sprint": "RL-014",
  "decision": "DT-D045"
}
