{
  "candidate_id": "SRC-CAND-000004",
  "id_immutable": true,
  "metadata": {
    "title": "2017-2022 Ford F-450 Super Duty Chassis Cab Regular Cab 60 CA DRW Blueprint",
    "source_type": "VECTOR_BLUEPRINT_COMMERCIAL",
    "document_class": "2D_DIMENSIONAL_REFERENCE",
    "reference_class": "PROFILE_REFERENCE",
    "not_oem_engineering_geometry": true,
    "publisher": "Outlines (GetOutlines)",
    "reported_year": 2017,
    "legacy_aliases": ["EDTS-CAND-001", "C-001"],
    "source_url": "https://getoutlines.com/vector-drawings/30637/2017-2022-ford-f-450-super-duty-drawings",
    "source_url_status": "URL_RECORDED",
    "reported_cost_usd": 24.0,
    "reported_formats": ["EPS", "SVG", "AI", "CDR"]
  },
  "acquisition_status": "NOT_ACQUIRED",
  "access_status": "NOT_ACQUIRED",
  "research_confidence_rc": 78,
  "reasoning_log": [
    {
      "at": "2026-07-16T19:50:00Z",
      "rc": 78,
      "note": "Real listing URL recorded for Regular Cab Chassis Cab 60 CA DRW band including 145.3 WB exterior proportions. Hunt value as 2D dimensional / profile reference only — NOT ground-truth geometry, NOT OEM engineering geometry (Hard Rule 14). RC reduced for 2020+ band + exterior-only content."
    }
  ],
  "bound_vehicle_instance_id": "VEH-000001",
  "bound_configuration_id": "CFG-000001",
  "configuration_fingerprint": "sha256:dde6a6251b97900dc192587903ce30a236de18f311996231a3f488ef0429d943",
  "local_file_path": null,
  "sha256": null,
  "hash_status": "NOT_EXECUTED",
  "page_extraction_status": "NOT_EXECUTED",
  "evidence_status": "DISCOVERED",
  "related_source_registry_id": null,
  "closes_conflicts": [],
  "closes_questions": [],
  "parallel_lanes_triggered": ["LANE_A_DOC", "LANE_VIS", "LANE_DIM"],
  "forbidden_uses_until_acquired": [
    "geometry_freeze",
    "treating_2d_as_inner_structure_truth",
    "auto_applying_2020_plus_layers_to_2019_harness"
  ],
  "notes": [
    "Decision DT-D039: CANDIDATE_ACQUISITION_RECOMMENDED (Priority acquire).",
    "After purchase: ingest via EAE CORE (local file), hash full bytes, bind extracts to CFG-000001 only.",
    "Alias EDTS-CAND-001 from RL-008 sprint narrative.",
    "Hard Rule 14 vocabulary: 2D_DIMENSIONAL_REFERENCE / PROFILE_REFERENCE."
  ],
  "research_sprint": "RL-008",
  "decision": "DT-D040"
}
